"name","item","item 2","item 3","review-truncated-words","review-words","time"
"何仙姑","设施：5.0","环境：5.0","服务：5.0","北京百货大楼9月25日有个周年庆，但是从这周到下周开始，就开始有一些互动活动，门口是时装周的活动，还有...","北京百货大楼9月25日有个周年庆，但是从这周到下周开始，就开始有一些互动活动，门口是时装周的活动，还有很多团购折扣，一层化妆品，打折力度还可以，大人，孩子的服装鞋帽在这里都可以买到，王府井步行街上大钟表的楼就是这里，从小就开始逛的商场，至今都是情怀啊！这可能是王府井地区历史最久的商场了，在保持历史样子的放下，不断创新，不忘初心，砥砺前行，为每一位消费者打造最好的购物体验","2022-09-18 23:29"
"你丑我瞎","设施：5.0","环境：5.0","服务：5.0","百货大楼可以说真的是与时俱进，老商场却能打造出网红打卡地，之前一想到百货大楼都是奶奶级别的人过来逛，...","百货大楼可以说真的是与时俱进，老商场却能打造出网红打卡地，之前一想到百货大楼都是奶奶级别的人过来逛，但其实进到商场里一点老旧感都没有，完全就是老少皆宜的商场！各种时尚品牌，各种网红打卡地，不得不给百货大楼点赞购物还可以兑换停车券，孩子逛的也特别开心！总之就是购物逛街遛娃的好地方！值得推荐！地下二层真的是让北京70,80后回忆满满","2022-09-18 20:52"
"元宝妈妈","设施：5.0","环境：5.0","服务：2.5","百货大楼我们打小儿就来，现在经常带着孩子去和平果局里玩儿，找找回忆，然后在二层给孩子买玩具枪，买完直...","百货大楼我们打小儿就来，现在经常带着孩子去和平果局里玩儿，找找回忆，然后在二层给孩子买玩具枪，买完直接6层萃华楼吃饭，我们差不多每周或隔一周就去，今个儿逛和平果局感觉特别不好👎，觉得心里特别别扭！我家孩子6岁多点，男孩儿，我们直接就去地下二层和平果局，一进左边，有一个卖中草药的地方，那里摆着手串什么的，可能是玻璃的，具体不知道，我孩子手一不小心，扒倒了摆着手串的托盘儿，手串摔了，我给捡起来了，工作人员说摔了6对，一对79，说按50给我，后来，我老公说就给200，我本来想报警，有孩子在，我不想跟她们吵闹，怕吓着孩子，我就给了200元，我们就走了，您说这不讹人吗？您什么东西呀？要那么多钱这是我这么多次来王府井百货大楼最差的体验！提醒一下各位：带孩子的一定要看好自个儿的孩子，别碰任何东西，不然就得买单","2022-09-17
  更新于2022-09-18 14:53"
"吃饭要带羊小胖和瓜尔佳","设施：5.0","环境：5.0","服务：5.0","北京时装周在王府井百货门口有时装秀
北京广播电视台实况转播，嘉宾走红毯，场面宏大
毛戈平彩妆独家赞助的...","北京时装周在王府井百货门口有时装秀
北京广播电视台实况转播，嘉宾走红毯，场面宏大
毛戈平彩妆独家赞助的大秀，毛戈平彩妆也是国货之光
小姐姐们都超级瘦，腿巨长巨细，穿着高跟鞋👠比普通人高一大截，衣服都超级漂亮，几个系列都是不同的风格，但都属于国潮系列，满满的中国元素，最喜欢华服系列，妆容服饰配乐都气势恢宏
王府井百货作为老牌商场虽然比不上新建商场的华丽和前卫，但作为北京商业的文化标志这些年也在悄然改变，很多国际大牌也入驻其中","2022-09-17 14:35"
"李李李李李yif","设施：5.0","环境：5.0","服务：5.0","百货大楼真的是王府井很有代表性的老商场了，在王府井步行街上，如果开车去的话，估计要停其他楼的下边，现...","百货大楼真的是王府井很有代表性的老商场了，在王府井步行街上，如果开车去的话，估计要停其他楼的下边，现在店铺比头些年要丰富了很多，更符合年轻人的购物需求
我当时是去看金饰的，整整一层，周大福和周生生的店都是一个柜台，一个东西非常全的旗舰店，基本可以满足想要的了。","2022-09-16 00:03"
"刘小妞子","设施：5.0","环境：5.0","服务：5.0","好久不来百货大楼，听这个名字还是小时候的回忆。来了之后感觉变化真的很快，把车停到b3有特斯拉充电，还很...","好久不来百货大楼，听这个名字还是小时候的回忆。来了之后感觉变化真的很快，把车停到b3有特斯拉充电，还很方便！三个车位没有人，而且地库很大～再说一下商场，b1都是超市小零食，b2有个老北京展，陪孩子吃吃看看挺开心的。一楼二楼玩具乐园很大可以看看","2022-09-15 18:01"
"C可乐.爱上冰.","设施：4.5","环境：4.5","服务：4.5","来王府井步行街怎能不逛逛百货大楼！在这里逛街感受的是一种情怀！9月百货大楼即将迎来店庆！“相遇照相馆...","来王府井步行街怎能不逛逛百货大楼！在这里逛街感受的是一种情怀！9月百货大楼即将迎来店庆！“相遇照相馆”网红打卡点已就位！约上朋友或家人一起定格美好的瞬间！
      网红打卡点位于商场东侧。从步行街正门旁边的转门进来就能看到！","2022-09-14 18:22"
"匿名用户","设施：5.0","环境：5.0","服务：5.0","王府井是一条很热闹的步行街，道路两旁全是可以逛的大厦，晚上可以一家人步行来到这里，从南走到北，可以边...","王府井是一条很热闹的步行街，道路两旁全是可以逛的大厦，晚上可以一家人步行来到这里，从南走到北，可以边吃边溜，推荐茉莉花味的冰淇淋，就在从南口进来的右手边，一个茶叶老牌子的门口。口味清淡，唇齿留香，可以来试试。","2022-09-14 15:54"
"Alex","设施：4.0","环境：4.0","服务：4.0","好久没来百货大楼了。看到上面的时钟，还是会感慨时光的流逝。
现在的百货大楼有两个馆。地下有和平果局。...","好久没来百货大楼了。看到上面的时钟，还是会感慨时光的流逝。
现在的百货大楼有两个馆。地下有和平果局。楼上有电影院和餐饮。作为老牌百货大楼，也跟上了时代的潮流。
也有品牌搞社群活动。作为北京的回忆，希望他越办越好。","2022-09-14 00:44"
"plinnacao","设施：4.0","环境：4.0","服务：4.0","王府井百货大楼作为新中国第一店，在计划经济的时代，百货大楼一货难求，全国人民来北京必到的打卡地，改革...","王府井百货大楼作为新中国第一店，在计划经济的时代，百货大楼一货难求，全国人民来北京必到的打卡地，改革开放后这里没有了以前的喧闹，品质追求高端和特色，店面也进行了多次的升级改造，门口的音乐喷泉很是壮观，但这次没有开放，门口施工。目前商场内有很多体验馆，商品琳琅满目，来这里不单是购物，更多是回忆。","2022-09-13 19:15"
"pipi100705","设施：0.5","环境：0.5","服务：0.5","","电话永远打不进去。这很让人恼火。","2022-09-07 15:42"
"春","设施：5.0","环境：5.0","服务：5.0","为了花掉商通卡，特意到百货大楼购物。环境真是比想象的好太多，宽松人少清新时尚，应有尽有，而没有...","为了花掉商通卡，特意到百货大楼购物。环境真是比想象的好太多，宽松人少清新时尚，应有尽有，而没有老国营的暮气。

特别是卫生间，设施很新设备齐全，宽敞干净。
选了老牌子安睡宝，价格适中，折扣力度很大。关键是贴身的质量要有保障。

六七层各地餐饮，丰俭由人，种类很多，地方不大 ，但并不觉得杂乱拥挤。和平菓局更是值得一看。","2022-09-06 16:07"
"李大格","设施：5.0","环境：5.0","服务：5.0","北京王府井是北京的地标，王府井百货大楼是王府井的地标。
从我记忆力，妈妈到北京旅游就要去趟王府井百货...","北京王府井是北京的地标，王府井百货大楼是王府井的地标。
从我记忆力，妈妈到北京旅游就要去趟王府井百货大楼。
王府井百货大楼就是某种意义上北京的一种标准，劳模张秉贵就是这里的售货员，是我们从小就知道的哇，现在还有个博物馆。","2022-09-04 19:12"
"及时行乐","设施：4.5","环境：4.5","服务：4.5","中华人民共和国成立后北京建造的第一座大型百货零售商场。营业面积1.8万平方米。

开业时间：1955年9月
位...","中华人民共和国成立后北京建造的第一座大型百货零售商场。营业面积1.8万平方米。

开业时间：1955年9月
位置：王府井步行街
公交：地铁八号线金鱼池站下车往南。

「和平菓局老北京风物馆」这里是王府井网红打开地。这是一个非常有年代感的地方，这里弥漫着老北京的文化传承。","2022-09-04 10:02"
"Meimei","设施：4.5","环境：4.5","服务：4.5","有年头没来百货大楼了，曾几何时留下多少童年记忆。大门外还是原来的模样，进去后就跟其他大型商场无异，一...","有年头没来百货大楼了，曾几何时留下多少童年记忆。大门外还是原来的模样，进去后就跟其他大型商场无异，一楼化妆品，滚梯上楼，只是闲逛了一会儿才看到熟悉的楼梯。
😷原因，商场经营压力山大，但整个商场依然干净整洁，商品琳琅满目。坚持，加油！送给每一个辛勤工作的人。","2022-09-03 12:10"
"爱吃章鱼的小丸子","设施：5.0","环境：5.0","服务：5.0","王府井百货大楼的服务那是超喜欢，绝对是一流，会员服务中心的工作人员解答顾客问题耐心细致，有些问题前台...","王府井百货大楼的服务那是超喜欢，绝对是一流，会员服务中心的工作人员解答顾客问题耐心细致，有些问题前台的服务员一时解决不了，会主动去协调主管部门，态度积极，一点不推脱，很有责任感，让会员服务中心有了实实在在的价值，增加了顾客在这里购物的信任感","2022-09-03 09:26"
"枫行Maple","设施：4.5","环境：4.5","服务：4.5","王府井步行街惊现蔦屋书店
就在步行街小广场上
原来是资生堂和书店的联合推广
有一些好看的周边和杂志
都不...","王府井步行街惊现蔦屋书店
就在步行街小广场上
原来是资生堂和书店的联合推广
有一些好看的周边和杂志
都不对外出售
喜欢变色猫杯和浮世绘首饰盒
购买资生堂产品可以获赠
听说蔦屋书店已经开进了大陆
期待北京开店的那一天！","2022-09-02 15:08"
"高兴就好","设施：5.0","环境：5.0","服务：5.0","逛逛新中国成立后北京建造的第一座大型百货零售商店—王府井百货
商场是北京老牌的商场，商场里面干净整洁...","逛逛新中国成立后北京建造的第一座大型百货零售商店—王府井百货
商场是北京老牌的商场，商场里面干净整洁，环境很好，是吃购娱的好去处。受大环境影响步行街上人很少。
逛商场能买到心仪的东西是最重要的。
跑了三个商场，来到百货大楼二层一眼就相中了玫而美的婆婆服，简单大气，上档次，价位也算亲民。
有需要就去转转吧，不购物还可以看看美丽的夜景。","2022-09-01 22:03"
"Meatamong","设施：4.5","环境：4.5","服务：4.5","在商场的地下二层，整体环境比较昏暗。

老胡同，老设施，对于95年之前出生的人过去，比较有感触。

怀旧零...","在商场的地下二层，整体环境比较昏暗。

老胡同，老设施，对于95年之前出生的人过去，比较有感触。

怀旧零食区，里面的食品也不算太怀旧，反而南锣鼓巷里那些怀旧小零食会更全。

这里吸引人的主要是场景，大概逛30分钟就结束了。","2022-09-01 17:51"
"匿名用户","设施：4.5","环境：4.5","服务：0.5","","还是服务啊好失望啊，后门不让进问了一下，这看门的保安态度及差，横着说不让进48小时核酸，不会好好说啊，吃了炝药啦哈","2022-08-31 14:28"
"Dr.咚咚","设施：4.5","环境：4.5","服务：4.5","位置：王府井步行街，北京的老牌商场了，和周围新建的高楼一起也不落伍。
环境：商场品类齐全...","位置：王府井步行街，北京的老牌商场了，和周围新建的高楼一起也不落伍。
环境：商场品类齐全，吃喝玩乐都有，八层的横店电影院价格亲民，环境也很好。看完电影，吃点东西，逛逛街，王府井商场很多，人群被分流，商场没人不多，逛逛很清净。","2022-08-31 00:06"
"无机道长","设施：5.0","环境：5.0","服务：5.0","","百货大楼相遇照相馆！
活动非常有意思","2022-08-30 11:48"
"soulmate_7","设施：4.5","环境：4.5","服务：0.5","","服务电话无人接听 ～周二上午10点开始 拨打48分钟无人接听","2022-08-30 10:49"
"土肥","设施：5.0","环境：5.0","服务：5.0","大名鼎鼎的张秉贵，家喻户晓的熟识度，不过现在的孩子们是不知道是谁了，80后的回忆
恰巧在和平果局...","大名鼎鼎的张秉贵，家喻户晓的熟识度，不过现在的孩子们是不知道是谁了，80后的回忆
恰巧在和平果局的电梯口处，给儿子讲了讲张秉贵爷爷的故事，去古怪看了看，现在的糖果🍬可真是选择多，不像小时候就那么几种。","2022-08-29 23:03"
"李雪","设施：4.5","环境：4.5","服务：4.5","","#相遇的美好时刻#王府井67周年快乐","2022-08-29 16:29"
"爱的就是你023","设施：4.5","环境：4.5","服务：4.5","第一次来北京就到这里来过了，虽然过了十几年，楼下还是很多卖国埔，糕点的地方只不过哪个时候生意很好，现...","第一次来北京就到这里来过了，虽然过了十几年，楼下还是很多卖国埔，糕点的地方只不过哪个时候生意很好，现在的人大概没有吃这种食品的积极性了。
     其实逛商场你不一定要买什么，哪怕是简简单单的看看就觉得特别满足。现在物资特别多，突然一股思想在心里，我哪个时候好年轻啊，现在30几了买得起了，可是我却不想买了","2022-08-28 17:57"
"dazhzhshfs","设施：5.0","环境：5.0","服务：5.0","","虽然是北京人，但是却不常来，有十年没来过了，变化特别大。","2022-08-25 10:21"
"七彩","设施：4.5","环境：4.5","服务：4.5","王府井-北京百货-新中国第一店
对面东安市场-斜对面新中国儿童用品商场
里面很干净-每层都有卫生间-可乘坐...","王府井-北京百货-新中国第一店
对面东安市场-斜对面新中国儿童用品商场
里面很干净-每层都有卫生间-可乘坐直梯👏

地下一层怀旧小时候-免费+主要进来看这个的+想起了小时候

一层化妆品💄
二层就是服饰了🎽
里面挺高大上的","2022-08-24 16:26"
"风浦","设施：4.5","环境：5.0","服务：4.5","","王府井百货大楼，地下一层有个老北京胡同，很不错，勾起很多回忆。","2022-08-24 15:42"
"宇智波神龟","设施：5.0","环境：5.0","服务：5.0","","真的是豪华 多金 有钱人的天堂 有空来逛逛 找找人生奋斗的动力","2022-08-21 09:22"
"匿名用户345","设施：4.5","环境：4.5","服务：4.5","","很有历史感的百货大楼，但进门总觉得缺了点东西，仔细想了一下，大概缺了好闻的香氛的味道，如果有了香氛，应该立马会有日本桥高岛屋的感觉","2022-08-20 16:26"
"管的着我是谁吗","设施：4.5","环境：4.5","服务：4.5","","地下二层的@和平菓局 
复古老北京风情街
八十年代回忆杀
拍照打卡网红地","2022-08-18 21:03"
"东城春早时","设施：5.0","环境：5.0","服务：5.0","上世纪五十年代建造的北京市百货大楼今天仍不落伍。与内部相比大楼外观变化要小些，大楼内部改造的非常豪华...","上世纪五十年代建造的北京市百货大楼今天仍不落伍。与内部相比大楼外观变化要小些，大楼内部改造的非常豪华、现代，灯火辉煌商品琳锒满目！只有第11张图片能够看到旧时百货大楼楼梯的模样！
    店内帅哥靓女的广告引人侧目，但最后一张美吗？！有人曾说过，吊眼单眼皮高颧骨冷面女性是在丑化中国人！","2022-08-15 17:17"
"喜羊羊07","设施：4.5","环境：4.5","服务：4.5","","去大楼，在一楼看见了张秉贵纪念馆，摆放着各种纪念品，介绍他平凡的事情，还有展示柜台，和各种糖果，小时候最爱吃奶油球，酸三色，酥糖，软糖等，值得推荐去看看","2022-08-15 15:42"
"啥呀迪卡","设施：5.0","环境：5.0","服务：5.0","商场是北京老牌的商场里面还是那么好，设施齐全，商场里面干净整洁，环境很好，是去购物吃饭完的好去处，后...","商场是北京老牌的商场里面还是那么好，设施齐全，商场里面干净整洁，环境很好，是去购物吃饭完的好去处，后面还有步行街，人也很多，还有喷泉，不行街人满为患，回复到了以前的那种感觉哦，各种老北京的特色在地下一层，值得推荐！","2022-08-12 20:20"
"Cynthia","设施：5.0","环境：5.0","服务：5.0","北京的标志～金街很久没有出门，感觉跟以往的王府井相比较，现在真的人好少外地游客比往年也少了...","北京的标志～金街很久没有出门，感觉跟以往的王府井相比较，现在真的人好少外地游客比往年也少了很多。不过因为没有那么多人反而逛起来比较舒服整体环境整洁，商品专柜布置比较合理，商品也很丰富。秋高气爽的感觉真好！","2022-08-10 18:03"
"阳光地带","设施：4.5","环境：4.0","服务：4.0","王府井百货大楼1955年成立 ，到现在已经有五十多年了 ，是王府井的地标性建筑 ，好多外地的游客都在那儿 ，...","王府井百货大楼1955年成立 ，到现在已经有五十多年了 ，是王府井的地标性建筑 ，好多外地的游客都在那儿 ，能买到许多奇特的东西 ，234层就是百货楼顶两层 各种吃的很多 。
   不过现在也许是因为大环境的原因，客流不多，希望能从现以往人头传动的景象。","2022-08-09 18:30"
"饕餮行者也","设施：4.5","环境：4.5","服务：4.5","🔵高端，大气，上档次
王府井百货大楼1955年成立，至今已有50多年，
是王府井步行街地标性建筑，也是外地...","🔵高端，大气，上档次
王府井百货大楼1955年成立，至今已有50多年，
是王府井步行街地标性建筑，也是外地游客必逛之地

商场分为南馆和北馆，两个馆都比较大，一层是化妆品和珠宝，上面的楼层是服装餐饮等等

商场高端，且位置处于商业氛围最浓重的步行街，物价自然而然就要高的很多。所以本地人来此地还是少的，外地人非常多，周末的时候都是人山人海。","2022-08-07 08:08"
"符星星","设施：5.0","环境：5.0","服务：5.0","北京王府井百货和北京市百货大楼在一个地方，挨着，还有新中国儿童用品商店！总之东单这边算是北京最著名的...","北京王府井百货和北京市百货大楼在一个地方，挨着，还有新中国儿童用品商店！总之东单这边算是北京最著名的步行街了！外地游客尤其多，好多都是拉着行李箱逛的！这里有家稻香村还是挺不错的，至少是真的，要么稻香村太多了，都不知道真假！","2022-08-06 16:25"
"Freda72","设施：4.5","环境：4.5","服务：4.5","王府井百货大楼地下二层的平菓局很早之前就兴趣体验一下了，这回终于有机会。这波回忆杀猝不及防，一边走一...","王府井百货大楼地下二层的平菓局很早之前就兴趣体验一下了，这回终于有机会。这波回忆杀猝不及防，一边走一边指着某个布景与同伴滔滔不绝的说自己小时候的故事，小时候的小零食大家都爱吃些什么，小时候的动画都爱看些什么，小时候都在玩什么样的游戏机战绩如何，哈哈很好的体验。","2022-08-03 15:11"
"纳兰芊芊","设施：4.5","环境：4.5","服务：4.5","好久没去了，前几年好像重装了一次，现代感十足，但仍保留了老式的楼梯，能回味小时候的味道～
一层各种大...","好久没去了，前几年好像重装了一次，现代感十足，但仍保留了老式的楼梯，能回味小时候的味道～
一层各种大牌化妆品，经常有活动。楼下的和平果局很有特色，能回味老北京的感觉，还能买些“奇特”玩意～
二三四层就是百货，楼顶两层各种吃食很多。
夜晚外景很美","2022-08-02 22:14"
"囍乐儿","设施：5.0","环境：5.0","服务：5.0","2019.11.9来王府井附近吃饭，吃完就过来逛逛，算是王府井的地标商场了吧。游客络绎不绝。算是一个老牌商场...","2019.11.9来王府井附近吃饭，吃完就过来逛逛，算是王府井的地标商场了吧。游客络绎不绝。算是一个老牌商场。各大品牌都有。比较高端。随便一件衣服都价格不便宜。我这也就是逛逛饱饱眼福。地下还有一些卖特产的。","2022-08-02 08:53"
"卓松年","设施：4.5","环境：5.0","服务：4.0","餐营业旅游业被新冠病毒腰折。 今天去了百货大楼看看，发现餐馆都只能接待半数人，简言之被腰折。买衣服的...","餐营业旅游业被新冠病毒腰折。 今天去了百货大楼看看，发现餐馆都只能接待半数人，简言之被腰折。买衣服的顧客更少了。公交车也是都有坐位，公交车的发车间隔时间也比较长。疫情前，从我家去王府井要一个多小时，现在也只需要一半的时间。今天还是周六，王府井大街仍空空如也。随手拍几张照片，纪录当前的百货大楼和王府井大街，还有一栋烂尾楼已存在十多年了！","2022-07-30 13:59"
"LENGLA","设施：4.5","环境：4.5","服务：4.5","听的王府井土著来王府井百货给家里家里小祖宗买这最后的冰墩墩和雪容融，专卖挨着张秉贵纪念馆，不大的摊位...","听的王府井土著来王府井百货给家里家里小祖宗买这最后的冰墩墩和雪容融，专卖挨着张秉贵纪念馆，不大的摊位，但种类不少，关键是不像工美里那么闹腾，服务员大姐也是非常的热情，本来只想买两钥匙扣，最后还是买了满满一兜。如果是真爱，想买两个小可爱留个念想现在入手是挺不错的时候。","2022-07-26 20:36"
"买个西瓜趁热吃","设施：0.5","环境：0.5","服务：0.5","垃圾商场，停车费巨贵。停车布局十分不合理，管道层还改造成停车场。停车上还弥漫出一股臭味，尤其是到了地...","垃圾商场，停车费巨贵。停车布局十分不合理，管道层还改造成停车场。停车上还弥漫出一股臭味，尤其是到了地下三层，一股动物排泄物的气味十分刺鼻。
图一的门往里走，刚迈出一步就吐了。里面不仅臭，还很脏。闷热，潮湿，粘稠的质感，很恶心。甚至比外面更臭。
换了一个电梯，上到了七楼。结果发现门是锁的。失望至极","2022-07-25 23:52"
"July","设施：4.0","环境：4.0","服务：3.5","","一个相当有年代感的时尚大楼，里面的品牌都是相当有实力服饰非常有档次建议大家入手","2022-07-25 12:42"
"天朝小金刚","设施：5.0","环境：5.0","服务：5.0","这家商场犹如skp一样，应该都不用多介绍了。北京必逛一层的化妆品牌是真的超级全。包括冬奥会的时候...","这家商场犹如skp一样，应该都不用多介绍了。北京必逛一层的化妆品牌是真的超级全。包括冬奥会的时候，这里卖冰墩墩的柜台店面是最多的！现在也依然很全哦，特别是一些限量的。北京的劳力士门店和售后服务部这条街就有三家，不愧是金银街呢","2022-07-25 01:49"
"lws1019","设施：4.5","环境：5.0","服务：4.5","盛夏之际，三伏天路过这里，进百货大楼随意看看夏装和帽子。很久没来了，以前的格局不存在了，和大多数商场...","盛夏之际，三伏天路过这里，进百货大楼随意看看夏装和帽子。很久没来了，以前的格局不存在了，和大多数商场一样，一楼是化妆品、珠宝首饰；二楼开始到五楼，服装鞋帽，家居用品之类的；六、七楼，是餐厅美食，八楼有电影院正在开放，不知道在演什么电影，要扫码登记就没进去。于是坐直梯下来。
下到地下二层，一下给惊艳到了！满满的都是老北京过去的回忆。这里比看电影还要精彩：老北京的院子，旧时的胡同，时代的标签，开往新时代的列车，唱戏的小剧场，一切的一切，拍个小视频，拍个照片留念，很好，很好！这里，可是个值得一去的地方。","2022-07-24 20:58"
